row_number,Unnamed: 0_x,symbol,id,quarter,time,title,year,Unnamed: 0_y,name,speech,session
65,35,NTR.TO,NTR.TO_208052,4,2020-02-19 10:01:01,NTR.TO - Earnings call Q4 2019,2019,1713,Michael J. Frank,"[""So Jonas, as we build out our Retail business in Brazil, in the early days, there's not the traditional synergies that we get in North America or even in Australia because we have a big footprint that we tuck in the acquisitions into. As we build out our retail footprint in Brazil, primarily, we're expanding into new geographies, and so there's not significant synergies from a proprietary product standpoint or from an operational leverage standpoint.That being said, about 18 months ago, we acquired a nutritional business in Australia called Agrichem. And so as we expand our footprint in Brazil, our retail footprint, we do see that as a channel to increase our sales of Agrichem products, which are industry-leading nutritional products that come with really nice margins and customer benefits. And so that would be the one area of synergy. But again, just to set expectations, as we think about Brazil, we're really building out the backbone and the capability of our retail network, and that will likely take the next 2 or 3 years. And from that point, as we get that business established, as we tuck in from that point going forward, we'll see more synergies.""]",question_answer
66,35,NTR.TO,NTR.TO_208052,4,2020-02-19 10:01:01,NTR.TO - Earnings call Q4 2019,2019,1714,Operator,['Your last question comes from Jeff Zekauskas with JPMorgan.'],question_answer
67,35,NTR.TO,NTR.TO_208052,4,2020-02-19 10:01:01,NTR.TO - Earnings call Q4 2019,2019,1715,Jeffrey John Zekauskas,"['In your potash data, you show that Canpotex shipped about 17% of its volume to China in the quarter. Are those shipments priced at the old $2.90 per tonne delivered that the old China contract was under? Or is there a different set of prices that are used now?And secondly, Chuck, I think you said that acquisitions would benefit Retail EBITDA by $125 million in 2020. How much did they benefit Retail EBITDA in 2019?']",question_answer
68,35,NTR.TO,NTR.TO_208052,4,2020-02-19 10:01:01,NTR.TO - Earnings call Q4 2019,2019,1716,Charles Victor Magro,"[""Yes. Jeff, so I'll have Ken Seitz answer the potash question, and then we can come back and answer the M&A question for Retail.""]",question_answer
69,35,NTR.TO,NTR.TO_208052,4,2020-02-19 10:01:01,NTR.TO - Earnings call Q4 2019,2019,1717,Kenneth A. Seitz,"[""Right. So yes, with respect to fourth quarter shipments into China, we position potash along our entire supply chain at any point in the year, and that's also true for China. And so the volumes that you would have seen go to China would have been provisionally shipped there and headed into bonded warehouses. As you probably know, China stopped additional shipments into that country, it's the imports at the end of August, yet Canpotex shipped in preposition material in anticipation of strong demand in China in 2020. And so the pricing mechanism for those provisionally shipped volumes will be that they're awaiting a new contract, which is relevant because, in fact, Canpotex is not the only supplier. So that when we look at port inventories in China and say, 3.5 million tonnes, well, about 1.5 million -- 1 million of those tonnes now are awaiting a new contract. And that new contract price will be the price for those provisionally shipped volumes.""]",question_answer
70,35,NTR.TO,NTR.TO_208052,4,2020-02-19 10:01:01,NTR.TO - Earnings call Q4 2019,2019,1718,Charles Victor Magro,"[""And then, Jeff, just to answer your second question. So the impact from the M&A for -- on 2019 was somewhere between $35 million and $40 million. As you know, we didn't close Ruralco until October, so that was really the driving difference, I think, between 2019 and 2020 as well as we have several of the other tuck-ins that will start to show benefit in 2020. So to answer your question, somewhere between $35 million and $40 million.""]",question_answer
71,35,NTR.TO,NTR.TO_208052,4,2020-02-19 10:01:01,NTR.TO - Earnings call Q4 2019,2019,1719,Operator,"['And there are no further questions at this time. I turn the call back over to Richard Downey, VP of Investor Relations.']",question_answer
72,35,NTR.TO,NTR.TO_208052,4,2020-02-19 10:01:01,NTR.TO - Earnings call Q4 2019,2019,1720,Richard  Downey,"['Thank you, operator. Thank you, everyone, for joining us today. And if you have any additional questions, Investor Relations is available to take your calls. Thank you.']",question_answer
73,35,NTR.TO,NTR.TO_208052,4,2020-02-19 10:01:01,NTR.TO - Earnings call Q4 2019,2019,1721,Operator,"[""This concludes today's conference call. You may now disconnect.""]",question_answer
