row_number,Unnamed: 0_x,symbol,id,quarter,time,title,year,Unnamed: 0_y,name,speech,session
21,35,NTR.TO,NTR.TO_208052,4,2020-02-19 10:01:01,NTR.TO - Earnings call Q4 2019,2019,1669,Pedro  Farah,"[""Andrew, our cash flow this year was particularly positive. And it surprised -- it's not a total surprise for those who are working here. We ended up last year pretty high in inventory. As you recall, we bought in anticipation of China tariffs. Last year, we also had a late season. And so this year, we did a lot of work to work down the inventory. So as we worked out this inventory, we produced very good cash flow, I think way in excess, of course, of earnings. And we think that the cash flow and working capital can continue to improve. Of course, there's going to be a lot of puts and takes, but we think that we -- the efforts we are putting this year will continue to bear fruits in this coming year.In terms of our capital allocation, how much we're going to be using for different uses. I mean our capital allocation strategy continues to be the same. So we'll -- after we protect the balance sheet and we spend in our sustaining capital to conserve our assets, we're going to be taking a look at everything in our compete for capital basis. We have a share buyback program active in January and February. And of course, we'll be looking at our different alternatives for inorganic growth and organic, and we'll be making decisions throughout the year. But we think working capital continues to behave well.""]",question_answer
22,35,NTR.TO,NTR.TO_208052,4,2020-02-19 10:01:01,NTR.TO - Earnings call Q4 2019,2019,1670,Charles Victor Magro,"[""Yes. Andrew, just a few other comments. I think Pedro covered that very well. So no change. We -- the company was built to generate significant cash flow even in market conditions like we saw last year. I think we've demonstrated that now. And the priorities haven't changed, right? We want to maintain our investment-grade rating. We have a very strong balance sheet. We want to protect our assets. So from a sustaining capital perspective, we allocate about $1 billion to put back into the assets to make sure that they're safe and reliable.And then beyond that, it's a matter of allocating the capital for the best long-term growth for the shareholder. And we think that we'll have enough cash to do both, to return capital through buybacks and increased dividends over time, and to invest through both organic and inorganic investments for long-term value creation.""]",question_answer
23,35,NTR.TO,NTR.TO_208052,4,2020-02-19 10:01:01,NTR.TO - Earnings call Q4 2019,2019,1671,Operator,['Your next question comes from Christopher Parkinson with Crédit Suisse.'],question_answer
24,35,NTR.TO,NTR.TO_208052,4,2020-02-19 10:01:01,NTR.TO - Earnings call Q4 2019,2019,1672,Lucas Charles Beaumont,"[""This is Lucas Beaumont on for Chris. So I just wanted to go on to Retail. Could you give us an update on the ongoing opportunity to further consolidate the North American market, given some of the recent large transactions? Do you think there's still the potential for midsized to large acquisitions there? Or should we be limiting our focuses to pretty much tuck-ins only at this point?""]",question_answer
25,35,NTR.TO,NTR.TO_208052,4,2020-02-19 10:01:01,NTR.TO - Earnings call Q4 2019,2019,1673,Charles Victor Magro,"[""Lucas, I'll have Mike Frank answer the question for you.""]",question_answer
26,35,NTR.TO,NTR.TO_208052,4,2020-02-19 10:01:01,NTR.TO - Earnings call Q4 2019,2019,1674,Michael J. Frank,"[""Lucas, I think as we think about our opportunities in North America, they're primarily tuck-ins. Obviously, if a significant retail asset came on to the market, we would look at it, of course, but we're always focused on quality and value generation for our shareholders. And so right now, we have, I think, a pretty solid lineup of tuck-in opportunities. Last year, we acquired over 73 retail branches through our tuck-in program. And I would anticipate in 2020, we'll have something similar in the U.S. for opportunities as well.Now as you may know, we're also looking at Brazil. So we announced an acquisition earlier this year of Agrosema. And we continue to look for opportunities to really build out the backbone of our Retail business in Brazil. So we're also focused on opportunities in that market as well.""]",question_answer
27,35,NTR.TO,NTR.TO_208052,4,2020-02-19 10:01:01,NTR.TO - Earnings call Q4 2019,2019,1675,Operator,['Your next question comes from Steve Hansen with Raymond James.'],question_answer
28,35,NTR.TO,NTR.TO_208052,4,2020-02-19 10:01:01,NTR.TO - Earnings call Q4 2019,2019,1676,Steven P. Hansen,"[""The target to double your digital sales in 2020 is notable. Can you perhaps describe if there's any changes to the platform over the course of the year that will help pull more farmers onto the platform? And perhaps, if it's not too early, just describe whether or not you're seeing any definitive market share benefits as a result of the platform.""]",question_answer
29,35,NTR.TO,NTR.TO_208052,4,2020-02-19 10:01:01,NTR.TO - Earnings call Q4 2019,2019,1677,Charles Victor Magro,"[""Steve, yes, we're very excited about the 2020 plan for our digital platform. Mike Frank will walk you through it.""]",question_answer
30,35,NTR.TO,NTR.TO_208052,4,2020-02-19 10:01:01,NTR.TO - Earnings call Q4 2019,2019,1678,Michael J. Frank,"[""Steve, so we turned on our order-taking capability on the platform a year ago, and we turned it on through the course of the first quarter, and we saw significant ramp-up of uptake of ordering online, finishing the year with just over $260 million of online orders.We -- in terms of changes to the platform, we continue to add more products onto the platform. Last year was primarily crop protection products. This year, we're adding seed ordering and fertilizer ordering capability onto the platform. And so that will, I think, generate additional revenue. And we've also added a number of other features to the platform that we're turning on in 2020. We recently turned on our crop planning tool, which allows our sales agronomists to sit down with our customers and plan their farm field by field across all inputs. It creates insights, both for our supply chain, but it also allows our sales agronomists to really work with our customers to provide those full acre solutions, including financing opportunities that we're now financing using Nutrien Financial, which is also integrated into the digital tool.So we're really creating a lot of convenience, digital insights from an agronomy standpoint. We're also now exposing field-level weather and spring conditions. And so there's a number of features that we've added on to the platform at the last half of 2019 and here early in 2020. So our anticipation of doubling our online orders is, I think, very achievable, and we've got a lot of momentum right now in that direction.""]",question_answer
31,35,NTR.TO,NTR.TO_208052,4,2020-02-19 10:01:01,NTR.TO - Earnings call Q4 2019,2019,1679,Operator,['Your next question comes from Steve Byrne with Bank of America.'],question_answer
32,35,NTR.TO,NTR.TO_208052,4,2020-02-19 10:01:01,NTR.TO - Earnings call Q4 2019,2019,1680,Steve Byrne,"['A fertilizer buyer in Brazil recently indicated that the potash sales into Brazil in recent months were sold only with a price cap and that the buyers were given 60 days to lock in the price, which, if this was a practice that was prevalent, certainly could have contributed to the plunge in pricing in that region. Can you comment on this? Was Canpotex involved in this selling practice? And if so, do you expect it to continue after the potash market tightens up?']",question_answer
33,35,NTR.TO,NTR.TO_208052,4,2020-02-19 10:01:01,NTR.TO - Earnings call Q4 2019,2019,1681,Charles Victor Magro,"[""Steve, I'll have Ken Seitz, our head of the Potash business, answer your question.""]",question_answer
34,35,NTR.TO,NTR.TO_208052,4,2020-02-19 10:01:01,NTR.TO - Earnings call Q4 2019,2019,1682,Kenneth A. Seitz,"[""Thanks, Steve. Yes, I can say that we have seen some smaller volumes moving in Brazil with different pricing mechanisms. But I can also tell you that for the large volumes and the large suppliers, that's not the case. It's certainly not the case for Canpotex. Canpotex has their very well-established channels into that country. And you can see the prices at $245, $250 a tonne with various rebates, depending on volume. But it's not the case that Canpotex is looking at untraditional pricing mechanisms with their customers into Brazil.""]",question_answer
35,35,NTR.TO,NTR.TO_208052,4,2020-02-19 10:01:01,NTR.TO - Earnings call Q4 2019,2019,1683,Operator,['Your next question comes from Adam Samuelson with Goldman Sachs.'],question_answer
36,35,NTR.TO,NTR.TO_208052,4,2020-02-19 10:01:01,NTR.TO - Earnings call Q4 2019,2019,1684,Adam L. Samuelson,"[""I was hoping to just get a little bit more color on the potash market outlook for 2020. So at the market level, it looks like you're forecasting about a 2.5 million tonne kind of increase in global shipments at the midpoint. Your own sales forecast calls for about a 1 million tonne increase in sales. And if I'm thinking about kind of new entrants in the market, we would think that there should probably be about 750,000 to 1 million more tonnes of EuroChem production incremental year-on-year.Given that, do you think that, with all the curtailments that took place in the industry in the fourth quarter of 2019, do you think that that's actually kind of there's enough room for everybody else to see a reasonable recovery and normalization of production? Or do you think that there's more capacity that has to primarily come off stream to balance the market?""]",question_answer
37,35,NTR.TO,NTR.TO_208052,4,2020-02-19 10:01:01,NTR.TO - Earnings call Q4 2019,2019,1685,Charles Victor Magro,"[""Adam, so I'll just give you a high-level perspective on your question here. Certainly, the setback last year when we had a reduction because of palm oil prices and then, of course, the U.S. weather impacted, before that, we were seeing very good growth. And we had a view that as the market continued to grow at its historical rate, it would require more supply, and the new entrant supply would fit pretty nicely into the increased demand. Obviously, in 2019, we had a reset. And I think Nutrien looked at our sales book, and we pulled back on our sales because, simply, we didn't have the customer base to support it.Now when we look at the 2020 plan, though, we're seeing what I would call a respectable growth, another 4% up from 2019 levels, getting back to basically 2018 levels. And so our plan, as outlined in my prepared remarks, is we are going to take our sales volumes up. And we think that it will be supported by growth in Southeast Asia and in North America. China is probably going to take a little less than they took last year. But overall, when we look at the sales plan that we've put forth, we think that the market is going to need the tonnes. And we're not sure exactly what others are planning or could do. But certainly, with the increased market that we see coming in 2020, depending on when we see a China settlement, our view strongly is that our sales plan makes a lot of sense for us and for our stakeholders. And then we'll just have to see how the rest of the market moves their tonnes into it. We don't really have a lot of insight on their sales plan.""]",question_answer
38,35,NTR.TO,NTR.TO_208052,4,2020-02-19 10:01:01,NTR.TO - Earnings call Q4 2019,2019,1686,Operator,['Your next question comes from John Roberts with UBS.'],question_answer
39,35,NTR.TO,NTR.TO_208052,4,2020-02-19 10:01:01,NTR.TO - Earnings call Q4 2019,2019,1687,John Ezekiel E. Roberts,"['At your Investor Day last year, you identified some nitrogen brownfield opportunities, both near term and a little bit longer term. Could you give us an update on where your thoughts are on that?']",question_answer
40,35,NTR.TO,NTR.TO_208052,4,2020-02-19 10:01:01,NTR.TO - Earnings call Q4 2019,2019,1688,Charles Victor Magro,"[""Yes. I'll have Raef Sully just walk you through the progress.""]",question_answer
41,35,NTR.TO,NTR.TO_208052,4,2020-02-19 10:01:01,NTR.TO - Earnings call Q4 2019,2019,1689,Raef M. Sully,"[""Yes. Thanks for the question, John. At the Investor Day, we identified about $300 million of spend on about 5 or 6 projects. The first wave of those is actually coming online this year. So if you look at our forecast volumes, we're expecting to see about 1 million tonnes more of product for sale in 2020 versus 2019. Some of that is ammonium sulfate, about 400,000 tonnes there. The other 700,000 tonnes is a mix of ammonia and urea. Some of that, of course, is from less planned outages. Some of it is the first wave of these expansion projects. We have some other projects coming online in '20. We should be finished our Borger expansions and also the [ Augusta urea ] plant. And so we'll see continued growth in volumes through '20 and then into 2021.""]",question_answer
42,35,NTR.TO,NTR.TO_208052,4,2020-02-19 10:01:01,NTR.TO - Earnings call Q4 2019,2019,1690,Operator,['Your next question comes from P.J. Juvekar with Citi.'],question_answer
43,35,NTR.TO,NTR.TO_208052,4,2020-02-19 10:01:01,NTR.TO - Earnings call Q4 2019,2019,1691,P.J.  Juvekar,"[""Chuck, you mentioned your -- that lower raw material cost in phosphates would be a headwind to a significant market recovery. Are you saying that phosphate prices are unlikely to go up due to lower raw materials? And what's your margin outlook?""]",question_answer
44,35,NTR.TO,NTR.TO_208052,4,2020-02-19 10:01:01,NTR.TO - Earnings call Q4 2019,2019,1692,Charles Victor Magro,"[""P.J., I'll have Raef Sully answer the questions for you.""]",question_answer
45,35,NTR.TO,NTR.TO_208052,4,2020-02-19 10:01:01,NTR.TO - Earnings call Q4 2019,2019,1693,Raef M. Sully,"[""So P.J., we think -- as you know, there was a lot of price decline through 2019 in phosphates. We saw OCP and other producers pull back from the U.S. market. We've seen prices come up a little bit. We suspect that they will probably come up a little bit further before the importers get back into the market in a big way. We don't think there'll be a large price appreciation. We think there'll be some. But the only thing I'd add, P.J., is that when you look at our Phosphate business, you remember that most of the margin these days comes from nonagricultural products that we sell, including on our purified industrial products.""]",question_answer
46,35,NTR.TO,NTR.TO_208052,4,2020-02-19 10:01:01,NTR.TO - Earnings call Q4 2019,2019,1694,Charles Victor Magro,"[""Yes. And P.J., one last point is just we did lower our total cost because we converted Redwater to an ammonium sulfate plant. We did some modest expansions of our 2 phosphate facilities in the U.S. And we -- of course, we're not buying imported rock anymore for Redwater. So overall, that's what's driven our cost. And even in these tough conditions we saw in '19, we did have positive margins, as Raef said, and most of our product mix is not related to agriculture. It's related to industrial business and food applications, which I think has more stable margins over the long term. So those 2 combinations, when we look at our business, it helps a lot. And it insulates us a little bit more then from the kind of the agricultural backdrop that we saw in 2018 and '19.""]",question_answer
47,35,NTR.TO,NTR.TO_208052,4,2020-02-19 10:01:01,NTR.TO - Earnings call Q4 2019,2019,1695,Operator,['Your next question comes from Mark Connelly with Stephens Inc.'],question_answer
48,35,NTR.TO,NTR.TO_208052,4,2020-02-19 10:01:01,NTR.TO - Earnings call Q4 2019,2019,1696,Mark William Connelly,"[""Two questions. Was all of the increase in ammonia controllable cost related to the turnarounds? And secondly, some farmers in the Midwest are telling us that soil moisture is too hard or too high. And I'm wondering in the middle of February whether that's a concern yet. But if they do stay too high, how is that going to affect your mix and timing in nitrogen?""]",question_answer
49,35,NTR.TO,NTR.TO_208052,4,2020-02-19 10:01:01,NTR.TO - Earnings call Q4 2019,2019,1697,Charles Victor Magro,"[""Mark, I'll have Raef Sully answer the first question. And then Mike can give you a view of moisture levels in the U.S., and then Raef can come back and talk about the impact.""]",question_answer
50,35,NTR.TO,NTR.TO_208052,4,2020-02-19 10:01:01,NTR.TO - Earnings call Q4 2019,2019,1698,Raef M. Sully,"[""Yes. So look, I mean there's certainly been -- I mentioned the expansion projects previously. There's been a mix of those, plus efficiency work going on with the large turnarounds we've been doing. So we certainly have been focusing on efficiency. I think, though, the majority of the costs would come from lower gas costs year-over-year. We've seen that in the U.S. Sorry, what was the...""]",question_answer
51,35,NTR.TO,NTR.TO_208052,4,2020-02-19 10:01:01,NTR.TO - Earnings call Q4 2019,2019,1699,Charles Victor Magro,"['Well, then I think let Raef answer -- or Mike will answer the question on soil moisture conditions.']",question_answer
52,35,NTR.TO,NTR.TO_208052,4,2020-02-19 10:01:01,NTR.TO - Earnings call Q4 2019,2019,1700,Michael J. Frank,"[""Mark, so the way we look at the U.S. right now is, from a Midwest standpoint, if you go south of I-80, I would say soil moisture is good, but not excessive. And as we talk to our customers throughout that region, they're anticipating getting in the field once it warms up. And for the most part, it's been a pretty mild winter through a lot of that region. If you go north of I-80, into the Dakotas and Minnesota, Wisconsin, obviously they had a really early winter hit them. Soil moistures, especially in South Dakota, are still high, but the ground is frozen. And so even though they've had solid snow conditions, the moisture hasn't been added to, I think, over the winter.So look, we're anticipating, as we've talked about, another 14 more million acres getting planted in 2020. And a lot of that, over 12 million acres of that is corn and beans that are going to go in, in the Midwest. And so that's our anticipation. And as we talk to our customers right now and we look at our order book, our order book for corn seed is incredibly strong, where we're seeing a lot of momentum in corn. And I would say the bean -- soybean order book is consistent with our expectation of about 85 million acres of soybeans right now. So that's what farmers are planning on and anticipating. And obviously, we need normal spring conditions in order for us to get those acres planted.""]",question_answer
53,35,NTR.TO,NTR.TO_208052,4,2020-02-19 10:01:01,NTR.TO - Earnings call Q4 2019,2019,1701,Charles Victor Magro,"[""And Mark, just to wrap up with your last point, it's -- we don't have any concerns right now on fertilizer applications for the spring season because of the weather or moisture conditions. It's a little too early to be concerned right now. And things look like they're proceeding as we would have expected them to.""]",question_answer
54,35,NTR.TO,NTR.TO_208052,4,2020-02-19 10:01:01,NTR.TO - Earnings call Q4 2019,2019,1702,Operator,['Your next question comes from Vincent Andrews with Morgan Stanley.'],question_answer
55,35,NTR.TO,NTR.TO_208052,4,2020-02-19 10:01:01,NTR.TO - Earnings call Q4 2019,2019,1703,Jeremy Noah Rosenberg,"['This is Jeremy Rosenberg on for Vincent. Just wanted to ask, on the potash outlook, looks like versus prior guidance, you took the India number down maybe about 450,000 tonnes at the midpoint; Latin America, down about 800,000 tonnes; and Other Asia looks basically unchanged. So just 2 quick ones. One is just, what drove the changes to the India and Latin America shipment numbers? And two, just given the decline in palm oil prices over the last, call it, month or so, if you just see any risk to the Other Asia demand number?']",question_answer
56,35,NTR.TO,NTR.TO_208052,4,2020-02-19 10:01:01,NTR.TO - Earnings call Q4 2019,2019,1704,Charles Victor Magro,"[""I'll have Jason Newton, our Chief Economist, answer your questions.""]",question_answer
57,35,NTR.TO,NTR.TO_208052,4,2020-02-19 10:01:01,NTR.TO - Earnings call Q4 2019,2019,1705,Jason  Newton,"[""Jeremy, on India, the major driver -- I mean we still expect year-over-year that we'll see shipments going into India, possible 500,000 tonnes. We ended up last year right around where we expect, about 4.1 million tonnes. We think there is some risk of subsea change in India as a result of lower prices. We'll watch that going forward. We do expect India to move up.In Southeast Asia, we expect the demand will be up about 1.5 million tonnes. And yet, palm oil prices have been really volatile, and that's related to the coronavirus. And -- but as we look at what the USDA analyst was saying in terms of the supply/demand outlook, it is tightening significantly. And so we think prices will be supportive as a result of that, and they're still up about 40% from the low of last year. And so we expect a rebound in that region, although not back up to 2018 levels.""]",question_answer
58,35,NTR.TO,NTR.TO_208052,4,2020-02-19 10:01:01,NTR.TO - Earnings call Q4 2019,2019,1706,Operator,['Your next question comes from Michael Piken with Cleveland Research.'],question_answer
59,35,NTR.TO,NTR.TO_208052,4,2020-02-19 10:01:01,NTR.TO - Earnings call Q4 2019,2019,1707,Michael Leith Piken,"['Just wanted to get a feel for how your Retail margins might look this year and what your expectations are, if we could kind of look at it from a crop nutrient standpoint as well as from seed and crop protection in light of maybe some additional rebating, discounting going on in the feed markets. And in the case of fertilizer, some of these prices, particularly UAN and phosphate may be below where pricing was during fill levels.']",question_answer
60,35,NTR.TO,NTR.TO_208052,4,2020-02-19 10:01:01,NTR.TO - Earnings call Q4 2019,2019,1708,Charles Victor Magro,['Mike Frank can answer the question.'],question_answer
61,35,NTR.TO,NTR.TO_208052,4,2020-02-19 10:01:01,NTR.TO - Earnings call Q4 2019,2019,1709,Michael J. Frank,"[""Yes. Michael, look, if we kind of go through the major categories, and from a margin standpoint as we head into 2020, firstly, from a nutrient standpoint, we were pleased with the performance of our nutrient business last year. Our margin per tonnes were up $6 a tonne across our global retail business. In Q4 and early days here in 2020, we're seeing those margins hold, and so we anticipate similar margins on a per tonne basis in 2020 that we delivered in 2019.On CPs, we had a very challenging first half of the year in CP. There was a lot of inventory that was carried into early 2019 across the retail network, and then the market was really slow to evolve. And that put a lot of margin pressure. And of course, as we reported our first half earnings last year, it was reflected in our margins in crop protection. As we -- as the year unfolded, we really recovered significantly, and we ended up holding our margins -- our gross margins pretty flat year-over-year.And so as we head into 2020, I would actually anticipate some positive opportunities on crop protection margins. We don't anticipate the delayed spring. I think channel inventories, including our own, have drawn down this time this year versus this time last year. And that should all be conducive to more regular levels of competition and opportunities for us from a margin standpoint.We also saw, just on the crop protection before I leave that, we also saw a little bit of a decline in our mix of proprietary products last year. And again, a lot of that was based on inventory that we had, that we wanted to sell the inventories that we had in our sheds. And so as we look at 2020, we would anticipate our mix of proprietary products to get back to where we were a year earlier, and that will also be constructive to margins.Finally, on the seed side, we are seeing to date margins on corn seed at pretty historic levels. And so -- and with more corn acres to be planted, that's going to be good for our seed margins. Soybean seed is probably where there's more competition this year. And so we're seeing a bit of margin erosion in our soybean seed business. So I would say that's probably the one area that we're watching out for. But overall, I think if you look at seed on an all-in basis, we'll likely be in similar margins as we've been historically, especially with more corn acres coming in.""]",question_answer
62,35,NTR.TO,NTR.TO_208052,4,2020-02-19 10:01:01,NTR.TO - Earnings call Q4 2019,2019,1710,Operator,['Your next question comes from Jonas Oxgaard with Bernstein.'],question_answer
63,35,NTR.TO,NTR.TO_208052,4,2020-02-19 10:01:01,NTR.TO - Earnings call Q4 2019,2019,1711,Jonas I. Oxgaard,['So wondering if you could talk a little bit more about your Brazil acquisition strategy and how the integration of the previous acquisition is going. Are we seeing any synergies out of that so far?'],question_answer
64,35,NTR.TO,NTR.TO_208052,4,2020-02-19 10:01:01,NTR.TO - Earnings call Q4 2019,2019,1712,Charles Victor Magro,"['Jonas, yes, so Mike Frank can answer the question.']",question_answer
